"","Title","Year","journal"
"1525","Hearing Improvement in Interposition Ossiculoplasty and Myringostapediopexy.",2018,"Indian J Otolaryngol Head Neck Surg"
"1526","High Resolution Computed Tomography of Temporal Bone: The Predictive Value in Atticoantral Disease.",2018,"Indian J Otolaryngol Head Neck Surg"
"1527","Screening of Newborn Hearing at a Tertiary Care Hospital in South India.",2018,"Indian J Otolaryngol Head Neck Surg"
"1528","Sutureless Tragal Cartilage Island Tympanoplasty: Our Experience.",2018,"Indian J Otolaryngol Head Neck Surg"
"1529","Differential Diagnosis of Post Auricular Swelling with Mastoid Bone Involvement.",2018,"Indian J Otolaryngol Head Neck Surg"
"1530","Long Term Outcomes of Intratympanic Dexamethasone in Intractable Unilateral Meniere's Disease.",2018,"Indian J Otolaryngol Head Neck Surg"
"1532","Study the Effect of Tubotympanic Disease on Bone Conduction Threshold.",2018,"Indian J Otolaryngol Head Neck Surg"
"1533","Revisiting Correlation Between Pre Operative High Resolution Computed Tomography and Operative Findings in Attico Antral Disease.",2018,"Indian J Otolaryngol Head Neck Surg"
"1534","Evaluation of a Dermoplasty Technique for the Control on Nasal Polyps.",2018,"Indian J Otolaryngol Head Neck Surg"
"1535","Minimal Invasive Endoscopic Ear Surgery: A Two Handed Technique.",2018,"Indian J Otolaryngol Head Neck Surg"
"1536","Post-operative Sensorineural Hearing Loss After Middle Ear Surgery.",2018,"Indian J Otolaryngol Head Neck Surg"
"1537","A Comparative Study of Type-I Underlay Tympanoplasty with Temporalis Fascia Graft Alone and with Conchal Cartilage.",2018,"Indian J Otolaryngol Head Neck Surg"
"1538","To Evaluate the Pre and Post Shunt Sensorineural Hearing Loss in Hydrocephalus Patients.",2018,"Indian J Otolaryngol Head Neck Surg"
"1539","Comparison of Ossiculoplasty Using Autograft Ossicle Versus Allograft (Teflon).",2018,"Indian J Otolaryngol Head Neck Surg"
"1541","Newborn Hearing Screening: Time to Act!",2018,"Indian J Otolaryngol Head Neck Surg"
"1542","Transwindow Suture Technique for Pseudocyst of Pinna.",2018,"Indian J Otolaryngol Head Neck Surg"
"1543","Microscopic Versus Endoscopic Myringoplasty: A comparative study.",2018,"Indian J Otolaryngol Head Neck Surg"
"1544","Vertigo: Incidences, Diagnosis and Its Relations with Hearing Loss.",2018,"Indian J Otolaryngol Head Neck Surg"
"1545","Prevalence of Otitis Media with Effusion in Children with Hearing Loss.",2018,"Indian J Otolaryngol Head Neck Surg"
"1546","The Role of Preoperative Computed Tomography of Temporal Bone in Atticotomy as a New Tool for Determining the Approach.",2018,"Indian J Otolaryngol Head Neck Surg"
"1547","Cochlear Implantation in Children with Otitis Media.",2018,"Indian J Otolaryngol Head Neck Surg"
"1548","Post Earthquake Equilibrium Disturbance: A Study After Nepal-India Earthquake 2015.",2018,"Indian J Otolaryngol Head Neck Surg"
"1549","Protective Effects of Silymarin Against Age-Related Hearing Loss in an Aging Rat Model.",2018,"Indian J Otolaryngol Head Neck Surg"
"1550","Speech Perception Skills of Hindi Speaking Children with Pre-lingual Hearing Loss Using Hearing Aids and Cochlear Implants.",2018,"Indian J Otolaryngol Head Neck Surg"
"1551","Osteoma: A Rare Case of Painless Postauricular Swelling.",2018,"Indian J Otolaryngol Head Neck Surg"
"1552","Comparative Analysis of Fascia Lata and Cartilage Graft in Revision Type 1 Tympanoplasty.",2018,"Indian J Otolaryngol Head Neck Surg"
"1553","Hearing Improvement After Type III Tympanoplasty: A Prospective Observational Study.",2018,"Indian J Otolaryngol Head Neck Surg"
"1554","Bacteriological Profile and Antimicrobial Susceptibility Pattern in Chronic Suppurative Otitis Media: A 1-Year Cross-Sectional Study.",2018,"Indian J Otolaryngol Head Neck Surg"
"1555","External Auditory Canal Paraganglioma with Chronic Otitis Media of Ear: A Rare Coexistence.",2018,"Indian J Otolaryngol Head Neck Surg"
"1556","Is HRCT Temporal Bone Necessary in All Cases of Active Squamous Chronic Otitis Media?",2018,"Indian J Otolaryngol Head Neck Surg"
"1557","Role of Orthopantomogram in Unexplained Earache.",2018,"Indian J Otolaryngol Head Neck Surg"
"1558","Evaluating Hearing Loss in Patients Undergoing Second Line Anti Tubercular Treatment.",2018,"Indian J Otolaryngol Head Neck Surg"
"1559","A Comparative Study of the Efficacy of Fat Plug Myringoplasty and Conventional Myringoplasty in Chronic Suppurative Otitis Media with Small Central Perforation.",2018,"Indian J Otolaryngol Head Neck Surg"
"1560","Role of Eustachian Dysfunction and Primary Sclerotic Mastoid Pneumatisation Pattern in Aetiology of Squamous Chronic Otitis Media: A Correlative Study.",2018,"Indian J Otolaryngol Head Neck Surg"
"1561","Role of Otoacoustic Emissions in Hearing Assessment of Neonates: A Prospective Observational Study.",2018,"Indian J Otolaryngol Head Neck Surg"
"1562","Comparative Study of Management of BPPV (Benign Paroxysmal Positional Vertigo) with only Drugs Versus Drugs Plus Epley Manoeuvre.",2018,"Indian J Otolaryngol Head Neck Surg"
"1563","How Efficacious is HRCT Temporal Bone in Determining the Ossicular Erosion in Cases of Safe and Limited Squamous Type CSOM?",2018,"Indian J Otolaryngol Head Neck Surg"
"1564","Comparative Study of Hearing Improvement of Type 1 Tympanoplasty Using Temporalis Fascia and Conchal Cartilage as Graft Material.",2018,"Indian J Otolaryngol Head Neck Surg"
"1565","Adverse Effect of Mobile Phone on Hearing in Healthy Individuals: A Clinical Study.",2018,"Indian J Otolaryngol Head Neck Surg"
"1567","Recurrence Rate after Endoscopic vs. Open Approaches for Juvenile Nasopharyngeal Angiofibroma: A Meta-analysis.",2018,"J Neurol Surg B Skull Base"
"1568","Racial Differences in Disease Presentation and Management of Intracranial Meningioma.",2018,"J Neurol Surg B Skull Base"
"1576","Effect of N-acetylcysteine on intimal hyperplasia and endothelial proliferation in rabbit carotid artery anastomosis.",2018,"Arch Med Sci"
"1577","MicroRNA-331-3p inhibits proliferation and metastasis of ovarian cancer by targeting RCC2.",2018,"Arch Med Sci"
"1578","miR-21 regulates vascular smooth muscle cell function in arteriosclerosis obliterans of lower extremities through AKT and ERK1/2 pathways.",2018,"Arch Med Sci"
"1580","Evaluation of the effectiveness of iodine prophylaxis in Poland based on over 20 years of observations of iodine supply in school-aged children in the central region of the country.",2018,"Arch Med Sci"
"1581","Is percutaneous computed tomography-guided biopsy sufficient to establish indolent lymphoma transformation?",2018,"Arch Med Sci"
"1582","Clinicopathological factors associated with novel prognostic markers for patients with triple negative breast cancer.",2018,"Arch Med Sci"
"1583","Evaluation of folate concentration in amniotic fluid and maternal and umbilical cord blood during labor.",2018,"Arch Med Sci"
"1584","Modulator role of infliximab and methotrexate through the transient receptor potential melastatin 2 (TRPM2) channel in neutrophils of patients with rheumatoid arthritis: a pilot study.",2018,"Arch Med Sci"
"1585","Prognostic role of traditional cardiovascular risk factors in patients with idiopathic pulmonary arterial hypertension.",2018,"Arch Med Sci"
"1586","Effects of blood pressure goals on cardiovascular outcomes in hypertensive patients.",2018,"Arch Med Sci"
"1587","Association of lipoprotein(a) and major adverse cardiovascular events in patients with percutaneous coronary intervention.",2018,"Arch Med Sci"
"1603","A successful application of adult polymyxin B-immobilized fiber column hemoperfusion to a neonate with septic shock",2018,"Acute Crit Care"
"1604","Successful percutaneous coronary intervention with extracorporeal membrane oxygenation support after right coronary artery dissection in an eisenmenger syndrome patient.",2018,"Acute Crit Care"
"1605","Two women presenting aborted sudden cardiac arrest as the first event of mitral valve disease",2018,"Acute Crit Care"
"1607","Dermoid Cyst of the Parotid Gland: A Rare Entity.",2018,"Indian J Otolaryngol Head Neck Surg"
"1608","A Survival Analysis of Hypopharyngeal Cancer Patients: A Hospital-Cancer registry Based Study.",2018,"Indian J Otolaryngol Head Neck Surg"
"1609","Laryngeal Leiomyosarcoma: A Rare Case.",2018,"Indian J Otolaryngol Head Neck Surg"
"1610","False Identity: Lymphoid Hyperplasia Imitating a Large Paraganglioma.",2018,"Indian J Otolaryngol Head Neck Surg"
"1611","Cervical Stabilization in Patients with Instability Resulting from Osteoradionecrosis with Subsequent Spondylodiscitis After Radiotherapeutic Treatment for Head- and Neck Carcinoma.",2018,"Indian J Otolaryngol Head Neck Surg"
"1612","Impact of Classroom Determinants on Psychosocial Aspects of Voice Among School Teachers of Indore, India: A Preliminary Survey.",2018,"Indian J Otolaryngol Head Neck Surg"
"1613","Longus Colli Tendinitis: The Lost Twin of Retropharyngeal Abscess.",2018,"Indian J Otolaryngol Head Neck Surg"
"1614","Our Assessment Using Palate Postoperative Problems Score (PPOPS): Tool for the Evaluation of Results in Palatal Surgery Techniques.",2018,"Indian J Otolaryngol Head Neck Surg"
"1615","Solitary Fibrous Tumor of the Dorsal Tongue Area.",2018,"Indian J Otolaryngol Head Neck Surg"
"1616","Pleomorphic Adenoma of Upper Lip: A Rare Case Presentation.",2018,"Indian J Otolaryngol Head Neck Surg"
"1617","Rhabdomyolysis in a Morbidly Obese Patient After Oral Cavity Free Flap Reconstruction.",2018,"Indian J Otolaryngol Head Neck Surg"
"1618","Early Diagnosis: A Seeming Misfortune for Osteosarcoma of Mandible-Rare Case Report.",2018,"Indian J Otolaryngol Head Neck Surg"
"1619","Adverse Cochlear Effects After Head and Neck Cancer Therapy.",2018,"Indian J Otolaryngol Head Neck Surg"
"1620","Conservative Curative Larynx Preserving Surgery for Subglottic Soft Tissue Recurrence Reinforced with Fascia-Lata and Strap Muscles.",2018,"Indian J Otolaryngol Head Neck Surg"
"1621","Release of Extra Articular Ankylosis of Jaws as a Sequelae of Cancrum Oris with Extensive Gingival Myasis in a Scoliosis Patient: A Rare Case Report.",2018,"Indian J Otolaryngol Head Neck Surg"
"1622","Adenoid Cystic Carcinoma of the Nasopharynx: A Case Series.",2018,"Indian J Otolaryngol Head Neck Surg"
"1623","Bilateral Pneumothorax Post Emergency Airway Intervention.",2018,"Indian J Otolaryngol Head Neck Surg"
"1624","Role of Intraoperative Cytology in Head and Neck Lesions: A Prospective Study.",2018,"Indian J Otolaryngol Head Neck Surg"
"1625","Comparative Evaluation of Immunohistochemical Expression of p16 with p16 Microsatellite Marker by PCR in Surgical Margins of Oral Squamous Cell Carcinoma.",2018,"Indian J Otolaryngol Head Neck Surg"
"1626","Submental Ectopic Thyroid Cyst: An Atypical Presentation.",2018,"Indian J Otolaryngol Head Neck Surg"
"1627","The Use of Dynamic Contrast-Enhanced Perfusion MRI in Differentiating Benign and Malignant Thyroid Nodules.",2018,"Indian J Otolaryngol Head Neck Surg"
"1628","Surgical Excision with Rotational Flap Reconstruction for Basosquamous Cell Carcinoma in Xeroderma Pigmentosa: A Case Report.",2018,"Indian J Otolaryngol Head Neck Surg"
"1629","Two Cases of Lingual Arteriovenous Malformations with Comorbidities Treated by Glue Embolization: A Report with Review of Literature.",2018,"Indian J Otolaryngol Head Neck Surg"
"1630","&quot;AIR LEAK SYNDROME&quot;: An Unusual Presentation of Foreign Body in the Airway.",2018,"Indian J Otolaryngol Head Neck Surg"
"1631","Cystic Myoepithelioma of Parapharyngeal Space.",2018,"Indian J Otolaryngol Head Neck Surg"
"1632","Laryngopharyngeal Reflux and GERD: Correlation Between Reflux Symptom Index and Reflux Finding Score.",2018,"Indian J Otolaryngol Head Neck Surg"
"1633","Study of Voice Disorders Among School Teachers in Goa.",2018,"Indian J Otolaryngol Head Neck Surg"
"1634","Design and Implementation of Competency Based Postgraduate Medical Education in Otorhinolaryngology: The Pilot Experience in India.",2018,"Indian J Otolaryngol Head Neck Surg"
"1635","Tonsillectomy by Cold Dissection and Coblation Techniques: A Prospective Comparative Study.",2018,"Indian J Otolaryngol Head Neck Surg"
"1636","Prevalence of HPV in Oral Squamous Cell Carcinoma in South West India.",2018,"Indian J Otolaryngol Head Neck Surg"
"1637","Maffucci Syndrome with Clival Enchondroma in Nasopharynx: A Case Report.",2018,"Indian J Otolaryngol Head Neck Surg"
"1638","Varied Presentation of Venous Ectasia Head and Neck: Case Series and Review of Literature.",2018,"Indian J Otolaryngol Head Neck Surg"
"1639","Correlation Between Superoxide Dismutase Serum Level Alteration with Neck Metastatic Tumor Post Cisplatin-Paclitaxel Chemotherapy Response in Nasopharyngeal Carcinoma Patients.",2018,"Indian J Otolaryngol Head Neck Surg"
"1640","Matrix Metalloproteinase-9 Expression and Status of Cervical Lymph Nodes in Patients with Nasopharyngeal Carcinoma.",2018,"Indian J Otolaryngol Head Neck Surg"
"1641","Branchial Cyst with Branchial Fistula: A Rare Association.",2018,"Indian J Otolaryngol Head Neck Surg"
"1642","Evaluation of Multimodality Management of Adenoid Cystic Carcinoma of the Head and Neck.",2018,"Indian J Otolaryngol Head Neck Surg"
"1643","Endoscopically-Associated Hairline Approach to Excision of Second Branchial Cleft Cysts.",2018,"Indian J Otolaryngol Head Neck Surg"
"1644","Ectopic Cervical Thymus in an Infant with Normal Orthotopic Thymus: Role of Imaging in Diagnosis and Management.",2018,"Indian J Otolaryngol Head Neck Surg"
"1645","Role of Preincisional Peritonsillar Infiltration of Bupivacaine in Postoperative Pain Relief in Tonsillectomy Patients.",2018,"Indian J Otolaryngol Head Neck Surg"
"1646","Does the Angle of Rigid Endoscope Makes a Difference in Videolaryngoscopy.",2018,"Indian J Otolaryngol Head Neck Surg"
"1647","A Perspective of Clinical Behaviour and Management of Deep Neck Space Infections (DNSI): The Clinical Conundrum.",2018,"Indian J Otolaryngol Head Neck Surg"
"1648","Kimura's Disease: A Rare Cause of Parotid Swelling.",2018,"Indian J Otolaryngol Head Neck Surg"
"1649","Monophasic Synovial Sarcoma of Tongue: A Rarest of Rare Case Scenario.",2018,"Indian J Otolaryngol Head Neck Surg"
"1650","Tracheostomy: Experience at Tertiary Hospital.",2018,"Indian J Otolaryngol Head Neck Surg"
"1651","Voice Change Following Adenotonsillectomy in Pediatric Population: Myth or Reality?-A Pilot Study.",2018,"Indian J Otolaryngol Head Neck Surg"
"1652","Management of Head and Neck Hemangiomas in Adults: Oral Propranolol Versus Oral Itraconazole in Conjugation with Injection Sodium Tetra Decyl Sulphate.",2018,"Indian J Otolaryngol Head Neck Surg"
"1653","Application of Standardised Yoga Protocols as the Basis of Physiotherapy Recommendation in Treatment of Sleep Apneas: Moving Beyond Pranayamas.",2018,"Indian J Otolaryngol Head Neck Surg"
"1654","Midline Congenital Upper Lip Sinus: A Rare Case.",2018,"Indian J Otolaryngol Head Neck Surg"
"1655","Audiological Evaluation in Hypothyroid Patients and Effect of Thyroxine Replacement Therapy.",2018,"Indian J Otolaryngol Head Neck Surg"
"1657","Management of Post-Traumatic Subglottic Stenosis and Pharyngosubglottic Fistula.",2018,"Indian J Otolaryngol Head Neck Surg"
"1658","Peripheral T Cell Lymphoma of Parotid Gland: A Diagnostic Challenge.",2018,"Indian J Otolaryngol Head Neck Surg"
"1659","&quot;Non-invasive Follicular Thyroid Neoplasm with Papillary like Nuclear Features&quot;: An Institutional Retrospective Study with Re-nomenclature and Re-classification.",2018,"Indian J Otolaryngol Head Neck Surg"
"1660","Serum Adenosine Deaminase Levels and Human Papillomavirus as Prognostic and Predictive Factors for Laryngeal and Pharyngeal Carcinomas.",2018,"Indian J Otolaryngol Head Neck Surg"
"1661","A Comprehensive Analysis of Benign Vocal Fold Lesions Causing Hoarseness of Voice and Our Experience with Cold Knife Endolaryngeal Surgery in a Tertiary Healthcare Centre.",2018,"Indian J Otolaryngol Head Neck Surg"
"1662","Analysis of Age-Related Differences of Risk Factors and Comorbidities in Laryngotracheal Stenosis Patients.",2018,"Indian J Otolaryngol Head Neck Surg"
"1663","Selective Neck Dissection Technique in the Treatment of Recurrent Pyriform Sinus Fistula.",2018,"Indian J Otolaryngol Head Neck Surg"
"1664","Changing Indications for Pediatric Tracheotomy: An Urban Indian Study.",2018,"Indian J Otolaryngol Head Neck Surg"
"1665","To Study the Role of FNAC in Pre-operative Diagnostic Work Up and Management in Parotid Tumours.",2018,"Indian J Otolaryngol Head Neck Surg"
"1666","Laryngectomy With or Without Partial Pharyngectomy: A Systematic Review.",2018,"Indian J Otolaryngol Head Neck Surg"
"1667","Association Between Voice Handicap Index and Praat Voice Analysis in Patients with Benign Vocal Cord Lesion Before and After Microscopic Laryngeal Surgery.",2018,"Indian J Otolaryngol Head Neck Surg"
"1668","A Study on Neck Nodes in Oral Cancers, with Special Reference to Skip Metastasis.",2018,"Indian J Otolaryngol Head Neck Surg"
"1669","Role of Adenoid-Nasopharyngeal Ratio in Assessing Adenoid Hypertrophy.",2018,"Indian J Otolaryngol Head Neck Surg"
"1670","Subjective Evaluation of Voice Characteristics of School Aged Children in a Basket Ball Team.",2018,"Indian J Otolaryngol Head Neck Surg"
"1671","Conventional Tracheostomy Versus Percutaneous Tracheostomy: A Retrospective Study.",2018,"Indian J Otolaryngol Head Neck Surg"
"1672","Airway Management and Bronchoscopic Treatment of Subglottic and Tracheal Stenosis Using Holmium Laser with Balloon Dilatation.",2018,"Indian J Otolaryngol Head Neck Surg"
"1673","Thyroid Dysfunction Following Management of Non-thyroid Head and Neck Cancers.",2018,"Indian J Otolaryngol Head Neck Surg"
"1674","Xanthelasma Palpebrarum: More than Meets the Eye.",2018,"Indian J Otolaryngol Head Neck Surg"
"1675","Vagal Paragangliomas: From Reducing Morbidity to Improving Quality of Life.",2018,"Indian J Otolaryngol Head Neck Surg"
"1676","Role of Cervical Vestibular Evoked Myogenic Potentials (cVEMP) as Outcome-Measure of Glycerol Test.",2018,"Indian J Otolaryngol Head Neck Surg"
"1677","Management of Mandible Fracture by Plating and Wiring: An Otolaryngologist Perspective at Teritiary Care Center.",2018,"Indian J Otolaryngol Head Neck Surg"
"1678","Assessment of Histopathological Grade and Ki-67 Expression in Tobacco and Non-tobacco Habitual Buccal Mucosa Cancer.",2018,"Indian J Otolaryngol Head Neck Surg"
"1679","Masses of the Paranasal Sinuses After Treatment of Nasopharyngeal Carcinoma: A Case Report.",2018,"Indian J Otolaryngol Head Neck Surg"
"1680","Bilateral Foreign Body Bronchus.",2018,"Indian J Otolaryngol Head Neck Surg"
"1681","Biopsy Examination Validity Based on Narrow Band Imaging Guidance of Nasopharyngeal Carcinoma Suspected Patients.",2018,"Indian J Otolaryngol Head Neck Surg"
"1682","Glossopharyngeal Nerve Block with Long Acting Local Anaesthetic Agent (Bupivacaine) and It's Effect on Early Post-operative Period in Adult Tonsillectomy: A Prospective Study.",2018,"Indian J Otolaryngol Head Neck Surg"
"1683","Correlation Between β-Catenin Expression and Staging in Nasopharyngeal Carcinoma Patients.",2018,"Indian J Otolaryngol Head Neck Surg"
"1684","Virtual Bronchoscopy: Highly Sensitive Time and Life Saving Investigation in the Diagnosis of Foreign Body Aspiration-Our Experience.",2018,"Indian J Otolaryngol Head Neck Surg"
"1685","Association Between Dose and Duration of Cisplatin Exposure with Cytotoxicity Effect on Nasopharyngeal Carcinoma Stem Cell.",2018,"Indian J Otolaryngol Head Neck Surg"
"1686","Dermatofibrosarcoma Protuberans of the Neck: A Brief Review of the Literature.",2018,"Indian J Otolaryngol Head Neck Surg"
"1687","Post Parotidectomy Quality of Life in Patients with Benign Parotid Neoplasm: A Prospective Study.",2018,"Indian J Otolaryngol Head Neck Surg"
"1688","Epidemiological Features and Management of Oral Cancer Patients: Experience from a Single Private Comprehensive Cancer Care Center in the State of Odisha.",2018,"Indian J Otolaryngol Head Neck Surg"
"1689","Penetrating Neck Injuries: from ER to OR.",2018,"Indian J Otolaryngol Head Neck Surg"
"1690","Transverse Cervical Artery Pseudoaneurysm: An Unusual Delayed Complication of Radical Neck Dissection.",2018,"Indian J Otolaryngol Head Neck Surg"
"1691","Factors Affecting Postoperative Complications After Reconstructive Surgery in Oral Carcinoma Patients: A Prospective Study of 100 Patients.",2018,"Indian J Otolaryngol Head Neck Surg"
"1692","Study of Pre and Post Operative Videostroboscopic Evaluation of Benign Vocal Cord Lesions.",2018,"Indian J Otolaryngol Head Neck Surg"
"1693","Outcome Analysis of Microlaryngeal Surgery for Benign Lesions of Vocal Cord Using Videostroboscopy and Voice Handicap Index.",2018,"Indian J Otolaryngol Head Neck Surg"
"1694","Intracell Heat Shock Protein 70 Expression and Nasopharyngeal Carcinoma Stage.",2018,"Indian J Otolaryngol Head Neck Surg"
"1696","Voice Analysis in Post Tonsillectomy Patients.",2018,"Indian J Otolaryngol Head Neck Surg"
"1697","Pectoralis Major Myocutaneous/Myofascial Flap and Split Skin Grafting for Repair of Post Laryngectomy Pharyngo Cutaneous Fistula: An Undemanding and a Reliable Solution.",2018,"Indian J Otolaryngol Head Neck Surg"
"1698","Epidemiological Profile of ENT Emergencies: Our Experience.",2018,"Indian J Otolaryngol Head Neck Surg"
"1699","Quality of Life in Patients with Reconstructions After Resections for Oral Cavity Cancers.",2018,"Indian J Otolaryngol Head Neck Surg"
"1700","Acquired Non-malignant Cervical Trachea-Esophageal Fistula: A Case Series.",2018,"Indian J Otolaryngol Head Neck Surg"
"1701","How Does Adenotonsillectomy Affect the Olfactory Threshold in Children?",2018,"Indian J Otolaryngol Head Neck Surg"
"1702","Ectopic Intratracheal Thyroid Tissue Leading to Stridor.",2018,"Indian J Otolaryngol Head Neck Surg"
"1703","Evaluation of Dynamic CT Scans and Analyzing Its Efficacy Accuracy in Staging of Laryngeal CA: A Prospective Analysis of 30 Patients and Review of Literature.",2018,"Indian J Otolaryngol Head Neck Surg"
"1704","An Overview of Parotidectomy for Benign Parotid Lesions with Special Reference to Perioperative Techniques to Avoid Complications: Our Experience.",2018,"Indian J Otolaryngol Head Neck Surg"
"1705","A Study of Clinicopathological Profile of Salivary Gland Swellings.",2018,"Indian J Otolaryngol Head Neck Surg"
"1706","Buccal Fat Pad a Forgotten Option of Reconstruction in Oral Cancer.",2018,"Indian J Otolaryngol Head Neck Surg"
"1707","Novice's Sojourn to Parotid Surgery.",2018,"Indian J Otolaryngol Head Neck Surg"
"1708","Fine-Sampled Photographic Quantitation of Dermal Wound Healing Senescence in Aged BALB/cByJ Mice and Therapeutic Intervention with Fibroblast Growth Factor-1.",2018,"Adv Wound Care (New Rochelle)"
"1709","Optic Nerve Enhancement and Restricted Diffusion in Postoperative Visual Loss.",2018,"Neuroophthalmology"
"1710","Efficacy and Safety of Long-Term Therapy with Type A Botulinum Toxin in Patients with Blepharospasm.",2018,"Neuroophthalmology"
"1711","Evolution of Hemophilia Care in India.",2018,"Indian J Hematol Blood Transfus"
"1719","Provision of simulation-based training (SBT) within UK vascular surgery training programmes.",2018,"Surgeon"
"1724","The developmental effects of isoflavone aglycone administration on early chick embryos.",2018,"Interdiscip Toxicol"
"1730","Insights on the relationship between structure vs. toxicological activity of antibacterial rhodamine-labelled 3-hydroxy-4-pyridinone iron(III) chelators in HepG2 cells.",2018,"Interdiscip Toxicol"
"1735","Differentiation of Types of Visual Agnosia Using EEG.",2018,"Vision (Basel)"
"1736","A Riemannian Geometry Theory of Three-Dimensional Binocular Visual Perception.",2018,"Vision (Basel)"
"1737","Evidence Transcranial Direct Current Stimulation Can Improve Saccadic Eye Movement Control in Older Adults.",2018,"Vision (Basel)"
"1738","Investigating Human Visual Sensitivity to Binocular Motion-in-Depth for Anti- and De-Correlated Random-Dot Stimuli.",2018,"Vision (Basel)"
"1739","Changes in Fixation Stability with Time during Binocular and Monocular Viewing in Maculopathy.",2018,"Vision (Basel)"
"1740","Effects of Exogenous and Endogenous Attention on Metacontrast Masking.",2018,"Vision (Basel)"
"1741","An Evolution of Suffering: Anesthesiology's Contribution to Pain Management.",2018,"J Anesth Hist"
"1742","Horst Otto Stoeckel: Collector and Museum Founder.",2018,"J Anesth Hist"
"1743","Horst Otto Stoeckel: Clinician, Administrator, Researcher.",2018,"J Anesth Hist"
"1746","Blood clot stability and bone formation following maxillary sinus membrane elevation and space maintenance by means of immediate implant placement in humans. A computed tomography study.",2018,"J Craniomaxillofac Surg"
"1747","Relationship between models of care and key rehabilitation milestones following unilateral transtibial amputation: a national cross-sectional study.",2018,"Physiotherapy"
"1768","Genomics, genetics and breeding of common bean in Africa: A review of tropical legume project.",2018,"Plant Breed"
"1772","Splenic Liquefaction after Splenic Artery Embolization.",2018,"Acute Crit Care"
"1773","Posterior Reversible Encephalopathy Syndrome after Hypovolemic Shock Which Is Required Differential Diagnosis with Delirium in the Intensive Care Unit.",2018,"Acute Crit Care"
"1774","Tension Pneumothorax after Attempting Insertion of a Central Venous Catheter.",2018,"Acute Crit Care"
"1777","Critical Care Research Using &quot;Big Data&quot;: A Reality in the Near Future.",2018,"Acute Crit Care"
"1778","Clinical Application of Modified Burns Wean Assessment Program Scores at First Spontaneous Breathing Trial in Weaning Patients from Mechanical Ventilation.",2018,"Acute Crit Care"
