"","Title","Year","journal"
"11","Generalized linear porokeratosis.",2018,"An Bras Dermatol"
"37","PHACE syndrome: clinical manifestations, diagnostic criteria, and management.",2018,"An Bras Dermatol"
"56","Yellow urticaria in a patient on prophylactic antiretroviral therapy.",2018,"An Bras Dermatol"
"61","Histogenetic categorization of atypical melanocytic tumor of uncertain biological malignant potential.",2018,"An Bras Dermatol"
"66","Donovanosis in a child victim of sexual abuse: response to doxycycline treatment.",2018,"An Bras Dermatol"
"69","Do you know this syndrome? Harlequin syndrome.",2018,"An Bras Dermatol"
"78","Complete lymphadenectomy following positive sentinel lymph node biopsy in cutaneous melanoma: a critical review.",2018,"An Bras Dermatol"
"85","Prevalence of dermatoses in patients referred for evaluation in an outpatient clinic of specialties.",2018,"An Bras Dermatol"
"126","Sweetpotato seed exchange systems and knowledge on sweetpotato viral diseases among local farmers in Acholi Sub Region-Northern Uganda.",2018,"Afr J Agric Res"
"131","The Effects of Resistance Training on Health of Children and Adolescents With Disabilities.",2018,"Am J Lifestyle Med"
"132","Factors Influencing Nutritional Behavior Among Patients With Metabolic Syndrome.",2018,"Am J Lifestyle Med"
"135","Response of Grain Legumes to Phosphorus Application in the Guinea Savanna Agro-Ecological Zones of Ghana.",2018,"Agron J"
"138","Virtual reality in the rehabilitation process for individuals with cerebral palsy and Down syndrome: A systematic review.",2018,"J Bodyw Mov Ther"
"141","[Impact of the kangaroo method of breastfeeding of preterm newborn infants in Brazil: an integrative review].",2018,"Cien Saude Colet"
"142","[Intra-family and school violence scale using the Item Response Theory].",2018,"Cien Saude Colet"
"143","[Large-scale contamination by Bisphenol A: are we aware of the risk and forms of exposure?]",2018,"Cien Saude Colet"
"144","When public health systems are news: a comparative analysis of the journalistic coverage in Brazil and Spain.",2018,"Cien Saude Colet"
"145","Recurrent apnea in an infant: Lessons for the clinician.",2018,"Med J Armed Forces India"
"146","Angiomyolipoma of vulva: Rare tumour at an unusual site.",2018,"Med J Armed Forces India"
"150","Robotic partial nephrectomy in a child with kidney tumor.",2018,"Turk J Urol"
"151","A rare congenital fusion anomaly of the urinary tract: Pancake kidney.",2018,"Turk J Urol"
"153","Black pearl in urology: Inadvertent anastomosis of gonadal vein to ureter leading to malpostioning of stent into the inferior vena cava.",2018,"Turk J Urol"
"154","Isolated flat desmoid-type terminal ileal mesenteric fibromatosis masquerading as lower ureteric stricture-an intraoperative surprise.",2018,"Turk J Urol"
"155","Management of ureteral endometriosis and review of the literature.",2018,"Turk J Urol"
"156","Selective renal segmental artery embolization for hydronephrotic upper renal moiety: simple alternative to standard surgical resection.",2018,"Turk J Urol"
"159","Portal hypertension in pregnancy - Concealed perils.",2018,"Obstet Med"
"160","Sexual behavior pattern in the young attending sexually transmitted infection clinic in a tertiary health-care center.",2018,"Indian J Sex Transm Dis AIDS"
"161","Is there any perceptiveness about the mode of transmission of human immunodeficiency virus/acquired immune deficiency syndrome? An analysis among the adolescent tribal students in Tamil Nadu.",2018,"Indian J Sex Transm Dis AIDS"
"162","Effectiveness of structured teaching programme on transmission and prevention of human immunodeficiency virus/acquired immune deficiency syndrome among adolescent girls in Lowry Memorial High School, Bengaluru.",2018,"Indian J Sex Transm Dis AIDS"
"163","A study on satisfaction level among patients attending sexually transmitted infections clinic.",2018,"Indian J Sex Transm Dis AIDS"
"165","Coexistence of inclusion lung with hydatid invasion: a rare case report.",2018,"Indian J Thorac Cardiovasc Surg"
"166","&quot;Double-ring&quot; combined aortic and mitral valve repair.",2018,"Indian J Thorac Cardiovasc Surg"
"168","Beyond Formal Access: Organizational Context, Working From Home, and Work-Family Conflict of Men and Women in European Workplaces.",2018,"Soc Indic Res"
"169","Flexible Working, Work-Life Balance, and Gender Equality: Introduction.",2018,"Soc Indic Res"
"175","Prevalence and factors associated with multimorbidities in Brazilian older adults.",2018,"Cien Saude Colet"
"176","[Prevention of physical disabilities due to leprosy in Brazil: a historic analysis].",2018,"Cien Saude Colet"
"177","Epidemiological trends of leprosy in Goiás, Brasil.",2018,"Cien Saude Colet"
"178","Mortality among former youth offenders.",2018,"Cien Saude Colet"
"188","[&quot;The guests are never right&quot; - Work-related self-understanding of bartenders working at hip venues].",2018,"Nordisk Alkohol Nark"
"189","Regular moderate aerobic exercise improves high-fat diet-induced nonalcoholic fatty liver disease via monoacylglycerol O-acyltransferase 1 pathway suppression.",2018,"J Sport Health Sci"
"190","Intravenous omega-3 fatty acids are associated with better clinical outcome and less inflammation in patients with predicted severe acute pancreatitis: A randomised double blind controlled trial.",2018,"Clin Nutr"
"196","Considerations about the Neuropsychiatric Conditions of Quixote of La Mancha.",2018,"Rev Colomb Psiquiatr"
"197","Adult Gender Dysphoria with Coronary Disease. Case Report and Literature Review.",2018,"Rev Colomb Psiquiatr"
"198","Reversible Alopecia Secondary to OROS Methylphenidate.",2018,"Rev Colomb Psiquiatr"
"199","Neurocognitive disorder due to neurosyphilis: a case report.",2018,"Rev Colomb Psiquiatr"
"200","Trazodone-induced delirium: case report.",2018,"Rev Colomb Psiquiatr"
"201","Factor Structure of Cotard's Syndrome: Systematic Review of Case Reports.",2018,"Rev Colomb Psiquiatr"
"202","An Explanatory Model of Suicidal Behaviour in Indigenous Peoples of the Department of Vaupés, Colombia.",2018,"Rev Colomb Psiquiatr"
"203","Risk of Eating Disorders and Use of Social Networks in Female Gym-Goers in the City of Medellín, Colombia.",2018,"Rev Colomb Psiquiatr"
"204","Psychometric Analysis of the Body Shape Questionnaire in Mexican University Students.",2018,"Rev Colomb Psiquiatr"
"205","Factors Associated With Suicidal Ideation in Older Adults From Three Cities in Colombia, 2016.",2018,"Rev Colomb Psiquiatr"
"206","Behavioural Disturbances in Patients with Diagnosis of Neurocognitive Disorder in Bogotá (Colombia).",2018,"Rev Colomb Psiquiatr"
"215","Non-contractability and Revenge.",2018,"Erkenntnis"
"216","Myomodulation with Injectable Fillers: An Innovative Approach to Addressing Facial Muscle Movement.",2018,"Aesthetic Plast Surg"
"217","Ideals of Facial Beauty Amongst the Chinese Population: Results from a Large National Survey.",2018,"Aesthetic Plast Surg"
"218","Dalbavancin is a novel antimicrobial against Gram-positive pathogens: clinical experience beyond labelled indications.",2018,"Eur J Hosp Pharm"
"219","Guidelines for evidence synthesis reporting: medications.",2018,"Eur J Hosp Pharm"
"220","Evaluation of the use, effectiveness and safety of tyrosine kinase inhibitors in chronic myelogenous leukaemia in a general university hospital.",2018,"Eur J Hosp Pharm"
"221","Inpatients' satisfaction towards information received about medicines.",2018,"Eur J Hosp Pharm"
"222","Analgesic consumption evolution at the emergency department of a university hospital (2006-2017): a defined daily doses based analysis.",2018,"Eur J Hosp Pharm"
"223","Microsatellite instability and sensitivity to fluoropyrimidine and oxaliplatin containing first-line chemotherapy in metastatic colorectal cancer.",2018,"Eur J Hosp Pharm"
"226","Brainstem tuberculoma: A delayed IRIS.",2018,"Indian J Tuberc"
"228","The principle of equivalence as a criterion of identity.",2018,"Synthese"
"231","Age-related changes in elastographically determined strain of the facial fat compartments: a new frontier of research on face aging processes.",2018,"Postepy Dermatol Alergol"
"232","Septic arthritis of the acromioclavicular joint: a case series and review of the literature.",2018,"Shoulder Elbow"
"235","Primitive neuroectodermal tumor of the kidney: A rare case with unusual presentation.",2018,"Med J Armed Forces India"
"236","Reactive airway dysfunction syndrome: Are we missing these patients?",2018,"Med J Armed Forces India"
"237","Enhancement of performance in an elite archer after non-pharmacological intervention to improve sleep.",2018,"Med J Armed Forces India"
"238","Improving exclusive breast feeding in the first 24 h of life using Plan-Do-Study-Act cycle in a tertiary care hospital.",2018,"Med J Armed Forces India"
"240","Former athletes' lifestyle and self-definition changes after retirement from sports.",2018,"J Sport Health Sci"
"242","ERRATUM.",2018,"Rev Bras Med Trab"
"244","ANAMT Technical Guideline (DT 05): prevention of occupational low back pain through back belts, lumbar support or braces.",2018,"Rev Bras Med Trab"
"245","Manifesto of Rio de Janeiro on public occupational health policies: towards strengthening, follow-up and implementation.",2018,"Rev Bras Med Trab"
"246","Foreword to the Manifesto of Rio de Janeiro.",2018,"Rev Bras Med Trab"
"247","Yoga and occupational health: integrative review of intervention studies.",2018,"Rev Bras Med Trab"
"248","A narrative review associating health vulnerability and environmental factors among rural workers.",2018,"Rev Bras Med Trab"
"249","Occupational stress in hospital settings: review of coping strategies of nursing professionals.",2018,"Rev Bras Med Trab"
"250","Physicians' working time restriction and its impact on patient safety: an integrative review.",2018,"Rev Bras Med Trab"
"251","Cross-cultural adaptation of Dimensions of Corporate Well-Being Scorecard to the Brazilian Portuguese language.",2018,"Rev Bras Med Trab"
"252","Epidemiological profile of sickness absenteeism at Oswaldo Cruz Foundation from 2012 through 2016.",2018,"Rev Bras Med Trab"
"253","Hand warts among butchers in a supermarket in São Paulo.",2018,"Rev Bras Med Trab"
"254","Occupational dermatoses in the Brazilian South region recorded in a reporting system (2007 to 2016).",2018,"Rev Bras Med Trab"
"255","Burnout syndrome and sleep quality among military police officers in Piaui.",2018,"Rev Bras Med Trab"
"256","Health-related physical fitness of military police officers in Paraiba, Brazil.",2018,"Rev Bras Med Trab"
"257","Analysis of physicians work ability, in the city of Maringá, Brazil.",2018,"Rev Bras Med Trab"
"258","Pilates instructors: prevalence of musculoskeletal pain, associated occupational factors and comparison of quality of life relative to Brazilian reference values.",2018,"Rev Bras Med Trab"
"259","Longitudinal evaluation of the quality of life of smoking motorcycle taxi drivers.",2018,"Rev Bras Med Trab"
"260","Sociodemographic and occupational profile and quality of life of health agents responsible for combating dengue in two towns in Parana, Brazil.",2018,"Rev Bras Med Trab"
"261","From Alma-Ata to Astana: why primary care is relevant to occupational health professionals?",2018,"Rev Bras Med Trab"
"262","Mesenteric metastases from mature teratoma of the testis: A case report.",2018,"Asian J Urol"
"271","Non-adjacent Dependency Learning in Humans and Other Animals.",2018,"Top Cogn Sci"
"275","Antisynthetase syndrome in pregnancy: A case and review of the literature.",2018,"Obstet Med"
"276","Two pregnancies after simultaneous pancreas-kidney transplantation: A case report.",2018,"Obstet Med"
"277","High aldosterone, hypertension and adrenal adenoma in a 36-year-old pregnant patient: Is this primary aldosteronism?",2018,"Obstet Med"
"281","Narrative Matters: You do you: teens' coconstruction of narrative, reality and identity on social media.",2018,"Child Adolesc Ment Health"
"287","Classical Harmony and Separability.",2018,"Erkenntnis"
"288","The Interface Between Empirical and Simulation-Based Ground-Motion Models.",2018,"Pure Appl Geophys"
"292","Arsenic trioxide encapsulated liposomes prepared via copper acetate gradient loading method and its antitumor efficiency.",2018,"Asian J Pharm Sci"
"295","Reaction to norm transgressions and Islamization threat in culturally tight and loose contexts: a cross-cultural comparison of Germany versus Russia.",2018,"Cult Brain"
"298","Theoretical and empirical analysis of trading activity.",2018,"Math Program"
"303","Exhibition Research and Findings: The Rare Privilege of Medicine.",2018,"J Anesth Hist"
"304","I Thought I Must Have Expired - Experiences of Surgery Before Anaesthesia.",2018,"J Anesth Hist"
"305","Improving surgical antibiotic prophylaxis adherence and reducing hospital readmissions: a bundle of interventions including health information technologies.",2018,"Eur J Hosp Pharm"
"306","Emergency drug kits at the Danish hospital pharmacies: varying management and challenges.",2018,"Eur J Hosp Pharm"
"307","Effects of a multifaceted intervention in psychogeriatric patients: one-year prospective study.",2018,"Eur J Hosp Pharm"
"308","Implementation and microbiological stability of dose-banded ganciclovir infusion bags prepared in series by a robotic system.",2018,"Eur J Hosp Pharm"
"312","Real-time sonoelastography evaluation of the Achilles tendon following ultrasound-guided platelet-rich plasma injection and eccentric exercise for the treatment of refractory Achilles tendinopathy.",2018,"Ultrasound"
"319","Contraceptive counseling lectures do not influence decision making in family planning services.",2018,"Cien Saude Colet"
"320","Psychometric Properties of the Brazilian Version of the Adolescent Health Promotion Scale (AHPS).",2018,"Cien Saude Colet"
"321","[Life after sexual reassignment surgery: significance for gender and transsexuality].",2018,"Cien Saude Colet"
"322","Gender and Sexuality in Brazilian Public Health undergraduation.",2018,"Cien Saude Colet"
"323","&quot;Step by step&quot;: the development of a therapeutic game to assist in the treatment of drug use.",2018,"Cien Saude Colet"
"324","Oral health and quality of life of pregnant women: the influence of sociodemographic factors.",2018,"Cien Saude Colet"
"325","[This elusive unknown quantity: reflections on the prescription of psychotropic drugs in early childhood].",2018,"Cien Saude Colet"
"326","[Sustainable and healthy work in a changing environment: What is the role and contribution of Public Health?]",2018,"Cien Saude Colet"
"327","[Matrix support and its relations with complexity theory].",2018,"Cien Saude Colet"
"328","[The history of the first attempt to produce marijuana-based medicines: Interview with Antônio José Alves].",2018,"Cien Saude Colet"
"329","[Factors associated with arterial hypertension: a systematic review].",2018,"Cien Saude Colet"
"330","Performance of the oral health team in home care in the context of the Family Health Strategy: an integrative review.",2018,"Cien Saude Colet"
"331","Violence and Primary Health Care in Brazil: an integrative literature review.",2018,"Cien Saude Colet"
"332","[Social, demographic, and health policies history of indigenous peoples from the state of Acre, Brazil].",2018,"Cien Saude Colet"
"333","Reflections on comprehensive care in the ethnic-racial context: an integrating review.",2018,"Cien Saude Colet"
"334","[Lack of access and the trajectory of healthcare use by elderly Brazilians].",2018,"Cien Saude Colet"
"335","[Effects of physical exercise on cardiovascular risk and quality of life in hypertensive elderly people].",2018,"Cien Saude Colet"
"336","[Memory stimulation training and the functionality of the elderly without cognitive impairment: an integrative review].",2018,"Cien Saude Colet"
"337","Does non-institutionalized elders have a better oral health status compared to institutionalized ones? A systematic review and meta-analysis.",2018,"Cien Saude Colet"
"338","Factors associated with elder abuse: a systematic review of the literature.",2018,"Cien Saude Colet"
"339","[Bibliometric analysis of the scientific evidence on violence perpetrated against the elderly].",2018,"Cien Saude Colet"
"340","Purpose in life in adulthood and older adulthood: integrative review.",2018,"Cien Saude Colet"
"341","[Use of public dental services by elderly Brazilians: a multilevel analysis].",2018,"Cien Saude Colet"
"342","[Validity and consistency of the entries in the Health Care Network's patient records for the use of services by the elderly].",2018,"Cien Saude Colet"
"343","Oral health condition and the use of dental services among the older adults living in the rural area in the south of Brazil.",2018,"Cien Saude Colet"
"344","Depression in the elderly of a rural region in Southern Brazil.",2018,"Cien Saude Colet"
"345","Use of potentially inappropriate medications in institutionalized elderly: prevalence and associated factors.",2018,"Cien Saude Colet"
"346","[The significance of home care in caring for the elderly in their twilight years: the human perspective of the SUS professional].",2018,"Cien Saude Colet"
"347","Knowledge and attitudes about sexuality in the elderly with HIV.",2018,"Cien Saude Colet"
"348","Factors associated with functional capacity in the elderly enrolled in the Family Health Strategy.",2018,"Cien Saude Colet"
"349","Risk factors associated with mortality in young and long-lived older adults in Florianópolis, SC, Brazil.",2018,"Cien Saude Colet"
"350","[Social integration profiles among non-frail elderly institutionalized individuals in Natal, State of Rio Grande do Norte, Brazil].",2018,"Cien Saude Colet"
"351","Quality of life evaluation of elderly people with HIV assisted in referral services.",2018,"Cien Saude Colet"
"352","[Dietary patterns of elderly Brazilians and associated determinants: a population-based study in the south of Brazil].",2018,"Cien Saude Colet"
"354","Evaluation of clinical and demographic characteristics of Turkish and Syrian pediatric cutaneous leishmaniasis patients from Hatay, Turkey after the Syrian civil war.",2018,"Postepy Dermatol Alergol"
"355","Impact of changing GOLD guidelines (2007-2011-2017) on assignment of a COPD patient to disease severity category.",2018,"Postepy Dermatol Alergol"
"356","Evaluation of carotid intima media thickness and hematologic inflammatory markers in patients with chronic spontaneous urticaria.",2018,"Postepy Dermatol Alergol"
"357","Ophthalmic manifestations of atopic dermatitis.",2018,"Postepy Dermatol Alergol"
"360","Non-invasive ventilation for acute respiratory failure during labor: A management dilemma.",2018,"Med J Armed Forces India"
"361","Left atrial cardiac rhabdomyoma: A rare tumour in an unusual location.",2018,"Med J Armed Forces India"
"362","Post partum posterior reversible encephalopathy syndrome presenting as sudden bilateral complete loss of vision without seizures.",2018,"Med J Armed Forces India"
"363","Triple anterior chamber following deep anterior lamellar keratoplasty: An unknown complication.",2018,"Med J Armed Forces India"
"364","Mesenchymal stem cells from orthodontic premolar teeth.",2018,"Med J Armed Forces India"
"365","Nixon and Scheel in China: Acupuncture and Anesthesia in West and East Germany in the 1970s and 1980s.",2018,"J Anesth Hist"
"369","The effect of levocetirizine and montelukast on clinical symptoms, serum level and skin expression of COX-1 and COX-2 enzymes in patients suffering from chronic autoimmune urticaria - a pilot study.",2018,"Postepy Dermatol Alergol"
"373","High Prevalence of Two or More Suicide Attempts Associated with Suicidal Ideation and Mental Disease in Colombia 2016.",2018,"Rev Colomb Psiquiatr"
"374","High Doses of Drugs Extensively Metabolized by CYP3A4 Were Needed to Reach Therapeutic Concentrations in Two Patients Taking Inducers.",2018,"Rev Colomb Psiquiatr"
"375","Depression and Abuse During Medical Internships in Peruvian Hospitals.",2018,"Rev Colomb Psiquiatr"
"376","The role of stressful life events appraisal in major depressive disorder.",2018,"Rev Colomb Psiquiatr"
"377","Grounded theory.",2018,"Rev Colomb Psiquiatr"
"378","Arthur Schopenhauer and psychiatry 200 years after the publication of The World as Will and Representation (Idea).",2018,"Rev Colomb Psiquiatr"
"379","Othello Syndrome Secondary to Cerebral Tuberculoma: A Case Report.",2018,"Rev Colomb Psiquiatr"
"380","Depression and sleep disorders related to hypertension: A cross-sectional study in Medellín, Colombia.",2018,"Rev Colomb Psiquiatr"
"381","Implementation of clinical practice guidelines for the timely detection and diagnosis of eating disorders in adolescents and adults in the outpatient and priority department of a public psychiatric hospital in Colombia.",2018,"Rev Colomb Psiquiatr"
"382","Muscle strength cut-offs for the detection of metabolic syndrome in a nonrepresentative sample of collegiate students from Colombia.",2018,"J Sport Health Sci"
"383","Costs resulting from nonprofessional soccer injuries in Switzerland: A detailed analysis.",2018,"J Sport Health Sci"
"391","Perception and practices of public hospital pharmacists towards the antimicrobial stewardship programme in the State of Selangor, Malaysia.",2018,"Eur J Hosp Pharm"
"392","External evaluation of a published population pharmacokinetic model of valproic acid in Thai manic patients.",2018,"Eur J Hosp Pharm"
"393","Management of diabetic foot ulcers: a 25% lidocaine topical cream formulation design, physicochemical and microbiological assessments.",2018,"Eur J Hosp Pharm"
"394","Vasopressin antagonist efficacy and safety in volume-overloaded critically ill patients: a new therapeutic alternative.",2018,"Eur J Hosp Pharm"
"395","Two regimens of dexamethasone versus prednisolone for acute exacerbations in asthmatic Egyptian children.",2018,"Eur J Hosp Pharm"
"396","Pharmaceutical care of patients with cancer treated on non-cancer wards in the UK: a mixed methods study.",2018,"Eur J Hosp Pharm"
"397","Medicines reconciliation in primary care: a study evaluating the quality of medication-related information provided on discharge from secondary care.",2018,"Eur J Hosp Pharm"
"404","Neglected medial swivel talonavicular dislocation treated with arthrodesis: A case report and literature review.",2018,"J Clin Orthop Trauma"
"406","Pharmacogenetics of Antipsychotic Drug Treatment: Update and Clinical Implications.",2018,"Mol Neuropsychiatry"
"407","Estimating Lactase Nonpersistence Distributions in the Multi-Ethnic Canadian Demographic: A Population-Based Study.",2018,"J Can Assoc Gastroenterol"
"411","Site-specific cancer risk in patients with type 2 diabetes: a nationwide population-based cohort study in Korea.",2018,"Korean J Intern Med"
"413","A Pilot Study Assessing the Therapeutic Potential of a Vibratory Positive Expiratory Pressure Device (Acapella Choice) in the Treatment of Voice Disorders.",2018,"J Voice"
"414","Crossing Gender Borders: Bidirectional Dynamic Interaction Between Face-Based and Voice-Based Gender Categorization.",2018,"J Voice"
"415","Voice Quality in Laryngeal Cancer Patients: A Randomized Controlled Study of the Effect of Voice Rehabilitation.",2018,"J Voice"
"418","Should physical laws be unit-invariant?",2018,"Stud Hist Philos Sci"
"419","Beyond the metrological viewpoint.",2018,"Stud Hist Philos Sci"
"420","Detail and generality in mechanistic explanation.",2018,"Stud Hist Philos Sci"
"421","Heaps of moles? - Mediating macroscopic and microscopic measurement of chemical substances.",2018,"Stud Hist Philos Sci"
"428","Organic anion transporters also mediate the drug-drug interaction between imipenem and cilastatin.",2018,"Asian J Pharm Sci"
"431","Validation of the St. Paul's Endoscopy Comfort Scale (SPECS) for Colonoscopy.",2018,"J Can Assoc Gastroenterol"
"432","Advanced Endoscopy Trainee Involvement Early in EUS Training May Be Associated with an Increased Risk of Adverse Events.",2018,"J Can Assoc Gastroenterol"
"433","Ulcerative Colitis Patients Continue to Improve Over the First Six Months of Vedolizumab Treatment: 12-Month Clinical and Mucosal Healing Effectiveness.",2018,"J Can Assoc Gastroenterol"
"434","The Gluten Free Diet: Assessing Adherence in a Pediatric Celiac Disease Population.",2018,"J Can Assoc Gastroenterol"
"435","Nurse-Led, Shared Medical Appointments for Common Gastrointestinal Conditions-Improving Outcomes Through Collaboration With Primary Care in the Medical Home: A Prospective Observational Study.",2018,"J Can Assoc Gastroenterol"
"438","The unicortical sternoclavicular joint reconstruction using synthetic graft.",2018,"Shoulder Elbow"
"439","Effectiveness of formal physical therapy following total shoulder arthroplasty: A systematic review.",2018,"Shoulder Elbow"
"440","The influence of fatty infiltration and muscle atrophy of the rotator cuff muscles on midterm functional outcomes in total shoulder resurfacing at six years' follow-up.",2018,"Shoulder Elbow"
"442","The Impact of RSV-Associated Respiratory Disease on Children in Asia.",2018,"J Pediatr Infect Dis"
"443","Compatible stability of methylprednisolone sodium succinate and tropisetron in 0.9% sodium chloride injection.",2018,"Eur J Hosp Pharm"
"444","Long-term stability of 0.1% rapamycin hydrophilic gel in the treatment of facial angiofibromas.",2018,"Eur J Hosp Pharm"
"445","Retrospective analysis of the correlation between tacrolimus concentrations measured in whole blood and variations of blood cell counts in patients undergoing allogeneic haematopoietic stem cell transplantation.",2018,"Eur J Hosp Pharm"
"446","Therapeutic drug monitoring of levetiracetam in daily clinical practice: high-performance liquid chromatography versus immunoassay.",2018,"Eur J Hosp Pharm"
"447","The Effect of Intraoperative Glove Choice on Carpal Tunnel Pressure.",2018,"J Hand Microsurg"
