"","Title","Year","journal"
"1779","The Effect of Systematic Approach to Tracheostomy Care in Patients Transferred from the Surgical Intensive Care Unit to General Ward.",2018,"Acute Crit Care"
"1780","Comparison between Gel Pad Cooling Device and Water Blanket during Target Temperature Management in Cardiac Arrest Patients.",2018,"Acute Crit Care"
"1781","Intensive Care Unit Relocation and Its Effect on Multidrug-Resistant Respiratory Microorganisms.",2018,"Acute Crit Care"
"1782","Impact of Socioeconomic Status on 30-Day and 1-Year Mortalities after Intensive Care Unit Admission in South Korea: A Retrospective Cohort Study.",2018,"Acute Crit Care"
"1783","Oxygenation Index in the First 24 Hours after the Diagnosis of Acute Respiratory Distress Syndrome as a Surrogate Metric for Risk Stratification in Children.",2018,"Acute Crit Care"
"1785","Critical Care after Lung Transplantation.",2018,"Acute Crit Care"
"1786","Critical Care before Lung Transplantation.",2018,"Acute Crit Care"
"1787","The Need for a Consensus Next-generation Sequencing Panel for Mature Lymphoid Malignancies.",2018,"Hemasphere"
"1788","Intensive Chemotherapy Is Associated With Poor Overall Survival in Autoimmune Disease-associated Myeloid Malignancies.",2018,"Hemasphere"
"1789","Insights on Multiple Myeloma Treatment Strategies.",2018,"Hemasphere"
"1790","Old Dogs, New Tricks: Revisiting Immune Modulatory Approaches for Myelodysplastic Syndromes.",2018,"Hemasphere"
"1792","Rituximab With Involved Field Irradiation for Early-stage Nodal Follicular Lymphoma: Results of the MIR Study.",2018,"Hemasphere"
"1793","Maintenance Therapy With Interleukin-2 for Childhood AML: Results of ELAM02 Phase III Randomized Trial.",2018,"Hemasphere"
"1794","A Comparison of High-Dose Cytarabine During Induction Versus Consolidation Therapy in Newly Diagnosed AML.",2018,"Hemasphere"
"1795","Blast Crisis of CML After TKI Discontinuation in a Patient With Previous Stable Deep Molecular Response: Is It Safe to Stop?",2018,"Hemasphere"
"1796","New Treatment Options in Advanced Stage Follicular Lymphoma.",2018,"Hemasphere"
"1797","Efficacy of Zanubrutinib in the Treatment of Bing-Neel Syndrome.",2018,"Hemasphere"
"1800","Mesenchymal Stromal Cells: Role in the BM Niche and in the Support of Hematopoietic Stem Cell Transplantation.",2018,"Hemasphere"
"1801","Diagnosis and Treatment of Chronic Myelomonocytic Leukemias in Adults: Recommendations From the European Hematology Association and the European LeukemiaNet.",2018,"Hemasphere"
"1803","Risk factors for diphtheria outbreak in children aged 1-10 years in East Kalimantan Province, Indonesia.",2018,"F1000Res"
"1806","Meet the patients where they are: A greater ambition for private provider engagement for TB.",2018,"J Clin Tuberc Other Mycobact Dis"
"1807","Quality: The missing ingredient in TB care and control.",2018,"J Clin Tuberc Other Mycobact Dis"
"1808","Role of Xpert MTB/RIF in Bronchoalveolar lavage fluid of sputum-scarce, suspected Pulmonary TB patients.",2018,"J Clin Tuberc Other Mycobact Dis"
"1809","The performance and yield of tuberculosis testing algorithms using microscopy, chest x-ray, and Xpert MTB/RIF.",2018,"J Clin Tuberc Other Mycobact Dis"
"1810","Results from a roving, active case finding initiative to improve tuberculosis detection among older people in rural cambodia using the Xpert MTB/RIF assay and chest X-ray.",2018,"J Clin Tuberc Other Mycobact Dis"
"1811","Molecular genotyping to differentiate endogenous reactivation and exogenous reinfection of recurrent tuberculosis.",2018,"J Clin Tuberc Other Mycobact Dis"
"1812","Miliary tuberculosis presenting as a choroidal mass and a tuberculosis screening review.",2018,"J Clin Tuberc Other Mycobact Dis"
"1813","Modeling DNA Unwinding by AddAB Helicase-Nuclease and Modulation by Chi Sequences: Comparison with AdnAB and RecBCD.",2018,"Cell Mol Bioeng"
"1816","ROS and NO Dynamics in Endothelial Cells Exposed to Exercise-Induced Wall Shear Stress.",2018,"Cell Mol Bioeng"
"1817","Ciliotherapy Treatments to Enhance Biochemically- and Biophysically-Induced Mesenchymal Stem Cell Osteogenesis: A Comparison Study.",2018,"Cell Mol Bioeng"
"1818","Molecular Imaging of a New Multimodal Microbubble for Adhesion Molecule Targeting.",2018,"Cell Mol Bioeng"
"1819","Missing anus: Do not miss it.",2018,"Med J Armed Forces India"
"1820","'Where did the tube go?' A case of retropharyngeal submucosal false passage during nasal intubation.",2018,"Med J Armed Forces India"
"1823","Direct antimicrobial susceptibility testing from positive blood culture bottles in laboratories lacking automated antimicrobial susceptibility testing systems.",2018,"Med J Armed Forces India"
"1824","A comparative study of masticatory performance in complete denture patients before and after application of soft liner.",2018,"Med J Armed Forces India"
"1825","Analysis of platelet-activating factors in severe sepsis by flow cytometry and its correlation with clinical sepsis scoring system: A pilot study.",2018,"Med J Armed Forces India"
"1826","A clinical study to describe the corneal topographic pattern and estimation of the prevalence of keratoconus among diagnosed cases of vernal keratoconjunctivitis.",2018,"Med J Armed Forces India"
"1827","Comparative evaluation of torque prescription of commercially available 018Roth and 022MBT PEA brands in maxillary anterior teeth.",2018,"Med J Armed Forces India"
"1828","A descriptive study of community-based profile and attitudes of body donors of an urban conglomeration in Western India.",2018,"Med J Armed Forces India"
"1829","Study of distribution of white-to-white corneal diameter and anterior chamber depth in study population obtained with optical biometry using intraocular lens (IOL) master.",2018,"Med J Armed Forces India"
"1830","Finite element analysis of displacement with single and two piece hollow bulb obturator prosthesis.",2018,"Med J Armed Forces India"
"1831","Faun tail nevus: A series of 15 cases and their management with Intense Pulse Light.",2018,"Med J Armed Forces India"
"1833","Bony bridge resorption after secondary alveolar grafting and correlation with success of orthodontic treatment: A prospective volumetric cone beam computed tomography (CBCT) study.",2018,"Med J Armed Forces India"
"1834","Sheets glide-assisted versus Busin glide-assisted insertion techniques for descemet stripping endothelial keratoplasty (DSEK): A comparative analysis.",2018,"Med J Armed Forces India"
"1835","Laparoscopic surgery in pancreatic diseases: Pushing the boundaries.",2018,"Med J Armed Forces India"
"1836","Does surgical difficulty relate to severity of acute cholecystitis? Validation of the parkland grading scale based on intraoperative findings.",2018,"Am J Surg"
"1858","Lower lymphocyte to monocyte ratio is a potential predictor of poor outcome in patients with cerebral venous sinus thrombosis.",2018,"Stroke Vasc Neurol"
"1859","Flow diversion covering the M1 origin as a last resort.",2018,"Stroke Vasc Neurol"
"1861","A forward-backward penalty scheme with inertial effects for monotone inclusions. Applications to convex bilevel programming.",2018,"Optimization"
"1862","Management of loose osteochondritis dissecans in an adolescent.",2018,"J Clin Orthop Trauma"
"1863","Osteoid osteoma of the sesamoid bone: An unusual localization.",2018,"J Clin Orthop Trauma"
"1866","Relationship between lower limb coordination and walking speed after stroke: an observational study.",2018,"Braz J Phys Ther"
"1867","Use of phage therapy to treat long-standing, persistent, or chronic bacterial infections.",2018,"Adv Drug Deliv Rev"
"1871","The double transfer of thermodynamics: From physics to chemistry and from Europe to America.",2018,"Stud Hist Philos Sci"
"1872","Project knowledge and its resituation in the design of research projects: Seymour Benzer's behavioral genetics, 1965-1974.",2018,"Stud Hist Philos Sci"
"1873","Knowledge transfer in agent-based computational social science.",2018,"Stud Hist Philos Sci"
"1874","The landing zone - Ground for model transfer in chemistry.",2018,"Stud Hist Philos Sci"
"1876","Knowledge transfer in theoretical ecology: Implications for incommensurability, voluntarism, and pluralism.",2018,"Stud Hist Philos Sci"
"1880","Procoagulant Activity of Red Blood Cell-Derived Microvesicles during Red Cell Storage.",2018,"Transfus Med Hemother"
"1881","Comparative transcriptome analysis of heat stress responsiveness between two contrasting ginseng cultivars.",2018,"J Ginseng Res"
"1892","Hepatoprotective effect of ultrasonicated ginseng berry extract on a rat mild bile duct ligation model.",2018,"J Ginseng Res"
"1894","Ginsenoside Rg1 promotes browning by inducing UCP1 expression and mitochondrial activity in 3T3-L1 and subcutaneous white adipocytes.",2018,"J Ginseng Res"
"1895","Ginsenoside Rg1 supplementation clears senescence-associated β-galactosidase in exercising human skeletal muscle.",2018,"J Ginseng Res"
"1896","Evaluation of the gastroprotective effects of 20 (S)-ginsenoside Rg3 on gastric ulcer models in mice.",2018,"J Ginseng Res"
"1898","Ginsenoside Rg1 activates ligand-independent estrogenic effects via rapid estrogen receptor signaling pathway.",2018,"J Ginseng Res"
"1899","Ginseng extracts modulate mitochondrial bioenergetics of live cardiomyoblasts: a functional comparison of different extraction solvents.",2018,"J Ginseng Res"
"1911","Avoiding malalignment in proximal femur fractures treated with newer generation cephalomedullary nails: Some technical tips.",2018,"J Clin Orthop Trauma"
"1912","Arthroscopic ankle fusion to manage sequel of loss of lateral malleoli in compound crushed ankle injury.",2018,"J Clin Orthop Trauma"
"1913","Ganglion cyst of Hoffa's fat pad of knee-a rare cause of knee pain and swelling-a case report and literature review.",2018,"J Clin Orthop Trauma"
"1914","Reliability and validity of Kannada version of Victorian Institute of Sports Assessment for patellar tendinopathy (VISA-P-K) questionnaire.",2018,"J Clin Orthop Trauma"
"1915","Static patellofemoral alignment in anterior cruciate ligament deficient knees; a retrospective analysis with magnetic resonance imaging.",2018,"J Clin Orthop Trauma"
"1916","Consensus on non-pharmacological interventions for mild and moderate knee osteoarthritis among stakeholders/experts of various disciplines is still elusive -A preliminary report.",2018,"J Clin Orthop Trauma"
"1917","High tibial osteotomy in obese patients: Is successful surgery enough for a good outcome?",2018,"J Clin Orthop Trauma"
"1918","Percutaneous fixation and balloon kyphoplasty for the treatment of A3 thoracolumbar fractures.",2018,"J Clin Orthop Trauma"
"1919","Standardized practice is associated with low rate of surgical site infection in orthopaedic trauma.",2018,"J Clin Orthop Trauma"
"1920","CB-NAAT MTB/RIF assay and histopathology correlation in diagnosis of osteoarticular tuberculosis using culture as reference standard.",2018,"J Clin Orthop Trauma"
"1921","Osseointegration of osteoporotic bone implants: Role of stem cells, Silica and Strontium - A concise review.",2018,"J Clin Orthop Trauma"
"1922","A unique skill station for improving hand to eye co-ordination for trainee residents or aspirants of arthroscopy.",2018,"J Clin Orthop Trauma"
"1923","Comparison of monosodium iodoacetate model of osteoarthritis between in-vivo and ex-vivo osteochondral unit in rabbits.",2018,"J Clin Orthop Trauma"
"1924","Molecular and Pathological Events Involved in the Pathogenesis of Diabetes-Associated Nonalcoholic Fatty Liver Disease.",2018,"J Clin Exp Hepatol"
"1932","Locally advanced squamous cell carcinoma of the renal pelvis masquerading as emphysematous pyelonephritis.",2018,"Urol Case Rep"
"1933","Orbital solitary fibrous tumor: A painless mass after a dacryochystorhinostomy.",2018,"Saudi J Ophthalmol"
"1934","Small cell neuroendocrine carcinoma of the orbit presenting as an orbital abscess in a young female.",2018,"Saudi J Ophthalmol"
"1935","Terminology of Peters' anomaly variants: Summary of histopathological findings in 6 corneas and detailed clinicopathological correlation in 2 cases.",2018,"Saudi J Ophthalmol"
"1936","Imaging of Adnexal Mass During Pregnancy.",2018,"J Obstet Gynaecol India"
"1937","RETRACTED ARTICLE: Advances in Diagnosis of Endometrial Hyperplasia.",2018,"J Obstet Gynaecol India"
"1938","Irisin as a Novel Marker for Insulin Resistance in Iraqi Women with Polycystic Ovary Syndrome Before and After Metformin Therapy.",2018,"J Obstet Gynaecol India"
"1939","Occult Malignancy Rate of 1498 Hysterectomies or Myomectomies with Morcellation: A Retrospective Single-Arm Study.",2018,"J Obstet Gynaecol India"
"1940","The Impact of Hysteroscopic Tissue Removal Systems on Histopathologic Analysis for Benign and Cancerous Endometrial Pathology: An Ex Vivo Study.",2018,"J Obstet Gynaecol India"
"1941","Prognostic Value of HER-2/neu Gene Amplification in Epithelial Ovarian Carcinoma.",2018,"J Obstet Gynaecol India"
"1942","Ultrasonic and Histopathological Evaluation to Exclude Premalignant and Malignant Lesions in Perimenopausal and Postmenopausal Women Presenting as Abnormal Uterine Bleeding.",2018,"J Obstet Gynaecol India"
"1943","ASCUS (Atypical Squamous Cells of Undetermined Significance) in the Cervical Smears of Women from Rural Population of Lucknow West.",2018,"J Obstet Gynaecol India"
"1944","Proximal Partial Vaginectomy for Vaginal Intraepithelial Neoplasia.",2018,"J Obstet Gynaecol India"
"1945","Evaluation of SEE-FIM (Sectioning and Extensively Examining the FIMbriated End) Protocol in Identifying Fallopian Tube Precursor Lesions in Women with Ovarian Tumors.",2018,"J Obstet Gynaecol India"
"1946","Uterine Sarcoma: A Clinico-Pathological Study.",2018,"J Obstet Gynaecol India"
"1947","NT-proBNP: A Useful Biochemical Marker for Prognosis in Rh-Isoimmunized Pregnancies.",2018,"J Obstet Gynaecol India"
"1948","Association of 2-Methoxyestradiol (2ME) Plasma Levels with Clinical Severity Indices and Biomarkers of Preeclampsia.",2018,"J Obstet Gynaecol India"
"1949","The Impact of Sleep-Disordered Breathing on Severity of Pregnancy-Induced Hypertension and Feto-Maternal Outcomes.",2018,"J Obstet Gynaecol India"
"1950","Nitric Oxide in the Prevention of Pre-eclampsia (NOPE): A Double-Blind Randomized Placebo-Controlled Trial Assessing the Efficacy of Isosorbide Mononitrate in the Prevention of Pre-eclampsia in High-Risk Women.",2018,"J Obstet Gynaecol India"
"1951","Case Control Study to Compare Serum Vascular Endothelial Growth Factor (VEGF) Level in Women with Recurrent Pregnancy Loss (RPL) Compared to Women with Term Pregnancy.",2018,"J Obstet Gynaecol India"
"1952","Observational Study of Third-Trimester Vitamin D3 Supplementation and Implications for Mothers and Neonates at Term.",2018,"J Obstet Gynaecol India"
"1953","Association of Pseudohypoparathyroidism and Autoimmune Polyglandular Syndrome: Causal or Coincidental?",2018,"Indian J Clin Biochem"
"1955","Assessment of FTO Gene Polymorphism and its Association with Type 2 Diabetes Mellitus in North Indian Populations.",2018,"Indian J Clin Biochem"
"1956","Diabetic Nephropathy Assessment: Microtubule-Associated Protein 1 Light-Chain 3B a New Promising Biomarker.",2018,"Indian J Clin Biochem"
"1957","Comparison of Serum Thyroglobulin Levels in Differentiated Thyroid Cancer Patients Using In-House Developed Radioimmunoassay and Immunoradiometric Procedures.",2018,"Indian J Clin Biochem"
"1959","Evaluation of the Expression Level and Hormone Receptor Association of miR-126 in Breast Cancer.",2018,"Indian J Clin Biochem"
"1963","Study of Insulin-Loaded Chitosan Nanoparticle Effects on TGF-β1 and Fibronectin Expression in Kidney Tissue of Type 1 Diabetic Rats.",2018,"Indian J Clin Biochem"
"1964","CCR5, MCP-1 and VDR Gene Polymorphisms Are Associated with the Susceptibility to HBV Infection.",2018,"Indian J Clin Biochem"
"1965","Acyclic Isoprenoid Attenuates Lipid Anomalies and Inflammatory Changes in Hypercholesterolemic Rats.",2018,"Indian J Clin Biochem"
"1966","Protective Role of Black Tea Flavonoids Against Ethanol-Induced Gastropathy via Matrix Metalloproteinase Pathway.",2018,"Indian J Clin Biochem"
"1978","Characterizing animal anatomy and internal composition for electromagnetic modelling in radar entomology.",2018,"Remote Sens Ecol Conserv"
"1990","Radiographic predictors determined with an objective assessment tool for neonatal patients with necrotizing enterocolitis.",2018,"J Pediatr (Rio J)"
"1991","Day care attendance during the first 12 months of life and occurrence of infectious morbidities and symptoms.",2018,"J Pediatr (Rio J)"
"2017","Update on Selected Topics in Acanthocephalan Parasites Research.",2018,"Helminthologia"
"2020","Soil Nematode Abundances were Increased by an Incremental Nutrient Input in a Paddy-upland Rotation System.",2018,"Helminthologia"
"2034","Facilitators of research registry enrollment and potential variation by race and gender.",2018,"J Clin Transl Sci"
"2036","Suspected Renal Impairment Following Isopropanol Ingestion.",2018,"J Appl Lab Med"
"2047","A case report of photodermatoses induced by the antifungal drug terbinafine.",2018,"Eur J Hosp Pharm"
"2048","High-dose quetiapine and therapeutic monitoring.",2018,"Eur J Hosp Pharm"
"2049","High-dose oral methylprednisolone for the treatment of multiple sclerosis relapses: cost-minimisation analysis and patient's satisfaction.",2018,"Eur J Hosp Pharm"
"2050","Comparisons of doxycycline solution with talc slurry for chemical pleurodesis and risk factors for recurrence in South Korean patients with spontaneous pneumothorax.",2018,"Eur J Hosp Pharm"
"2051","Stakeholder perceptions of a new model of care for medication supply at hospital discharge.",2018,"Eur J Hosp Pharm"
"2052","Medication regimen complexity on hospital admission in patients with advanced chronic conditions in need of palliative care.",2018,"Eur J Hosp Pharm"
"2053","Association between allopurinol use and hepatocellular carcinoma in a case-control study in Taiwan.",2018,"Eur J Hosp Pharm"
"2054","Exploring the experiences and opinions of hospital pharmacists working 24/7 shifts.",2018,"Eur J Hosp Pharm"
"2055","Clinical pharmacist intervention reduces mortality in patients with acute myocardial infarction: a propensity score matched analysis.",2018,"Eur J Hosp Pharm"
"2056","2019 Guts UK/Dr Falk awards are open for applications.",2018,"Frontline Gastroenterol"
"2057","Home parenteral nutrition in patients receiving palliative care: a curriculum-based review.",2018,"Frontline Gastroenterol"
"2058","Microscopic colitis: diagnosis and management.",2018,"Frontline Gastroenterol"
"2059","Experience of adopting faecal immunochemical testing to meet the NICE colorectal cancer referral criteria for low-risk symptomatic primary care patients in Oxfordshire, UK.",2018,"Frontline Gastroenterol"
"2060","Regional Sex Ratio and the Dissolution of Relationships in Germany.",2018,"Eur J Popul"
"2061","Online Distance Education and Transition to Parenthood Among Female University Students in Sweden.",2018,"Eur J Popul"
"2062","Gender Differences in Disability and Economic Hardship in Older Europeans.",2018,"Eur J Popul"
"2063","A Quantitative Assessment of the Rush Hour of Life in Austria, Italy and Slovenia.",2018,"Eur J Popul"
"2064","Time and Generation: Parents' Integration and Children's School Performance in Sweden, 1989-2011.",2018,"Eur J Popul"
"2065","Does Children's Union Dissolution Hurt Elderly Parents? Linked Lives, Divorce and Mental Health in Europe.",2018,"Eur J Popul"
"2066","Under-5 Mortality Rates in G7 Countries: Analysis of Fractional Persistence, Structural Breaks and Nonlinear Time Trends.",2018,"Eur J Popul"
"2067","Location-Scale Models in Demography: A Useful Re-parameterization of Mortality Models.",2018,"Eur J Popul"
"2071","46 XX male syndrome with hypogonadotropic hypogonadism: A case report.",2018,"North Clin Istanb"
"2072","Comparison of intraoperative ultrasonography guidance with an open surgical method for venous port catheter placement in chemotherapy.",2018,"North Clin Istanb"
"2074","Factors associated with diverticular bleeding and re-bleeding: A United States hospital study.",2018,"North Clin Istanb"
"2075","Echocardiographic assessment of children participating in regular sports training.",2018,"North Clin Istanb"
"2076","The hepatoprotective effect of Aloe vera on ischemia-reperfusion injury in rats.",2018,"North Clin Istanb"
"2083","Association between thyroid abnormalities and hypertension among hospitalized US patients: data from the National Inpatient Sample.",2018,"Cardiovasc Endocrinol Metab"
"2084","Vitamin D status in acute myocardial infarction: a case-control study.",2018,"Cardiovasc Endocrinol Metab"
"2085","Association between asymmetric dimethylarginine serum levels and left ventricular longitudinal deformation in patients with normal ejection fractions: a two-dimensional speckle-tracking echocardiography examination.",2018,"Cardiovasc Endocrinol Metab"
"2086","Serum leptin in male hypothyroid prediabetic patients: Association with cardiovascular risk.",2018,"Cardiovasc Endocrinol Metab"
"2087","In-vivo metabolic studies of regional adipose tissue.",2018,"Cardiovasc Endocrinol Metab"
"2092","Cardiac Troponin T: Only Small Molecules in Recreational Runners After Marathon Completion.",2018,"J Appl Lab Med"
"2093","Elevated TSH in a Thyroidectomized Patient: Differential Diagnosis Beyond Noncompliance with Treatment.",2018,"J Appl Lab Med"
"2094","Needle-Shaped Cholesterol Crystals in Pleural Fluid: An Unusual Presentation.",2018,"J Appl Lab Med"
"2095","Component-Resolved Diagnosis in Allergic Rhinitis and Asthma.",2018,"J Appl Lab Med"
"2096","Venous Thromboembolism: Role of the Clinical Laboratory in Diagnosis and Management.",2018,"J Appl Lab Med"
"2097","Recentrifugation of Lithium Heparin Gel Separator Tubes up to 8 h after Blood Collection Has No Relevant Influence on the Stability of 30 Routine Biochemical Analytes.",2018,"J Appl Lab Med"
"2098","Distinguishing Drug from Disease by Use of the Hydrashift 2/4 Daratumumab Assay.",2018,"J Appl Lab Med"
"2099","It's Not Just a Needlestick: Exploring Phlebotomists' Knowledge, Training, and Use of Comfort Measures in Pediatric Care to Improve the Patient Experience.",2018,"J Appl Lab Med"
"2100","Retrospective Data Analysis of the Influence of Age and Sex on TPMT Activity and Its Phenotype-Genotype Correlation.",2018,"J Appl Lab Med"
"2101","Derivation and Performance of Standardized Enhanced Liver Fibrosis (ELF) Test Thresholds for the Detection and Prognosis of Liver Fibrosis.",2018,"J Appl Lab Med"
"2102","Common Hormone Therapies Used to Care for Transgender Patients Influence Laboratory Results.",2018,"J Appl Lab Med"
"2103","Effect of Health and Training on Ultrasensitive Cardiac Troponin in Marathon Runners.",2018,"J Appl Lab Med"
"2104","Analytical Concordance of Diverse Point-of-Care and Central Laboratory Troponin I Assays.",2018,"J Appl Lab Med"
"2105","Cardiac Troponin in Endurance Exercise-Fragments of the Imagination or Clinical Significance?",2018,"J Appl Lab Med"
"2106","D-dimer: Common Assay, Challenges Abound, Caution Advised.",2018,"J Appl Lab Med"
"2107","Pick a Number, Any Number…Choosing Your Troponin Cutoff Wisely.",2018,"J Appl Lab Med"
"2108","Theranos: Almost Complete Absence of Laboratory Medicine Input.",2018,"J Appl Lab Med"
"2110","Biomarkers and Molecular Diagnostics for Early Detection and Targeted Management of Sepsis and Septic Shock in the Emergency Department.",2018,"J Appl Lab Med"
"2111","Infective Endocarditis in a Pediatric Patient.",2018,"J Appl Lab Med"
"2112","Procalcitonin and Its Limitations: Why a Biomarker's Best Isn't Good Enough.",2018,"J Appl Lab Med"
"2113","Embracing Procalcitonin for Antimicrobial Stewardship.",2018,"J Appl Lab Med"
"2114","Rapid Diagnostics for Blood Cultures: Supporting Decisions for Antimicrobial Therapy and Value-Based Care.",2018,"J Appl Lab Med"
"2115","The Use of Matrix-Assisted Laser Desorption/Ionization Time-of-Flight Mass Spectrometry (MALDI-TOF MS) for the Identification of Pathogens Causing Sepsis.",2018,"J Appl Lab Med"
"2116","Diagnosis and Monitoring of Acute Infections with Emphasis on the Novel Biomarker Human Neutrophil Lipocalin.",2018,"J Appl Lab Med"
"2117","Pathologic Difference between Sepsis and Bloodstream Infections.",2018,"J Appl Lab Med"
"2118","Metagenomics to Assist in the Diagnosis of Bloodstream Infection.",2018,"J Appl Lab Med"
"2119","Direct Detection of Pathogens in Bloodstream During Sepsis: Are We There Yet?",2018,"J Appl Lab Med"
"2120","Advances in Rapid Molecular Blood Culture Diagnostics: Healthcare Impact, Laboratory Implications, and Multiplex Technologies.",2018,"J Appl Lab Med"
"2121","Interplay between Rapid Diagnostic Tests and Antimicrobial Stewardship Programs among Patients with Bloodstream and Other Severe Infections.",2018,"J Appl Lab Med"
"2122","Diagnostic Challenges and Laboratory Considerations for Pediatric Sepsis.",2018,"J Appl Lab Med"
"2123","Comparison of the Abbott Architect BRAHMS and the Biomérieux Vidas BRAHMS Procalcitonin Assays.",2018,"J Appl Lab Med"
"2125","Osteoprotegerin is Higher in Sepsis Than in Noninfectious SIRS and Predicts 30-Day Mortality of SIRS Patients in the Intensive Care.",2018,"J Appl Lab Med"
"2126","Pediatric Anaerobic Blood Culture Practices in Industrialized Countries.",2018,"J Appl Lab Med"
"2127","The Use of Procalcitonin as a Sepsis Marker in a Community Hospital.",2018,"J Appl Lab Med"
"2128","Rapid Rule Out of Culture-Negative Bloodstream Infections by Use of a Novel Approach to Universal Detection of Bacteria and Fungi.",2018,"J Appl Lab Med"
"2129","Sepsis in Children with Febrile Neutropenia.",2018,"J Appl Lab Med"
"2130","Negative Blood Cultures: Is There Value in Ruling Out Negatives Faster Than 5 Days?",2018,"J Appl Lab Med"
"2131","What's Causing This Dark Brown Plasma?",2018,"J Appl Lab Med"
